{
  "packageVersion": "0.1",
  "packageId": "cocos-umaimono-fes-202601-golden",
  "createdAt": "2026-06-30",
  "createdBy": "codex-golden-replay",
  "status": "research-ready-for-codex",
  "language": {
    "official": "ja",
    "summary": "en"
  },
  "work": {
    "id": "umamusume",
    "officialNameJa": "ウマ娘 プリティーダービー",
    "displayNameEn": "Uma Musume Pretty Derby",
    "slug": "umamusume",
    "aliases": [
      "Uma Musume",
      "Umamusume",
      "ウマ娘"
    ]
  },
  "campaign": {
    "id": "cocos-umaimono-fes-202601",
    "workId": "umamusume",
    "officialTitleJa": "ココスへようこそ！ウマいものフェス！",
    "displayTitleEn": "COCOS Umaimono Festival campaign",
    "relatedTitleJa": "ウマ娘 プリティーダービー",
    "relatedTitleEn": "Uma Musume Pretty Derby",
    "slug": "cocos-umaimono-fes-202601",
    "status": "published",
    "periodLabel": "2026 Jan-Mar",
    "startDate": "2026-01-20",
    "endDate": "2026-03-16",
    "checkedAt": "2026-06-30",
    "partnerNames": [
      "ココス",
      "COCOS"
    ],
    "categories": [
      "card",
      "figure",
      "food",
      "goods",
      "prize"
    ],
    "heroAssetId": "cocos-umaimono-fes-hero",
    "cardMeta": {
      "period": "2026 Jan-Mar",
      "source": "Checked 2026-06-30",
      "items": "Menu / cards / prizes / goods"
    },
    "summaryJa": "ココスで開催されたウマ娘コラボ。対象メニューのクリアカード配布、特別メニュー、WEB抽選景品、一部店舗限定のアクリルスタンドパネル販売、公式Xキャンペーンをまとめています。",
    "summaryEn": "COCOS campaign archive covering menu-order clear cards, special set bonuses, web-lottery prizes, official-X poster prizes, and limited store goods.",
    "searchKeywords": [
      "Uma Musume COCOS",
      "ウマ娘 ココス",
      "ウマいものフェス",
      "clear card",
      "クリアカード",
      "special clear card",
      "スペシャルクリアカード",
      "acrylic panel",
      "アクリルスタンドパネル",
      "blanket",
      "ブランケット",
      "B2 poster",
      "B2ポスター"
    ],
    "sourceIds": [
      "cocos-umamusume-special-site"
    ],
    "itemIds": [
      "cocos-original-clear-cards",
      "cocos-special-set-menu",
      "cocos-acrylic-stand-panels",
      "cocos-original-blanket",
      "cocos-b2-posters"
    ],
    "marketNoteRequired": true,
    "evidenceRefs": [
      "ev-campaign-title",
      "ev-campaign-period",
      "ev-campaign-lineup"
    ],
    "fieldEvidenceRefs": {
      "officialTitleJa": [
        "ev-campaign-title",
        "ev-campaign-period",
        "ev-campaign-lineup"
      ],
      "periodLabel": [
        "ev-campaign-title",
        "ev-campaign-period",
        "ev-campaign-lineup"
      ],
      "startDate": [
        "ev-campaign-title",
        "ev-campaign-period",
        "ev-campaign-lineup"
      ],
      "endDate": [
        "ev-campaign-title",
        "ev-campaign-period",
        "ev-campaign-lineup"
      ],
      "partnerNames": [
        "ev-campaign-title",
        "ev-campaign-period",
        "ev-campaign-lineup"
      ],
      "categories": [
        "ev-campaign-title",
        "ev-campaign-period",
        "ev-campaign-lineup"
      ],
      "summaryJa": [
        "ev-campaign-title",
        "ev-campaign-period",
        "ev-campaign-lineup"
      ],
      "summaryEn": [
        "ev-campaign-title",
        "ev-campaign-period",
        "ev-campaign-lineup"
      ]
    }
  },
  "sources": [
    {
      "id": "cocos-umamusume-special-site",
      "type": "official",
      "url": "https://umamusume2026.cocos.jp/",
      "label": "ココス×ウマ娘キャンペーン公式特設サイト",
      "checkedAt": "2026-06-30",
      "scope": "Campaign overview, schedule, clear-card phases, special menu bonuses, web lottery, official X poster campaigns, store-limited acrylic panel sales, and campaign caveats.",
      "language": "ja",
      "reliability": "primary"
    },
    {
      "id": "cocos-umamusume-qa",
      "type": "official",
      "url": "https://umamusume2026.cocos.jp/qa.html",
      "label": "ココス×ウマ娘キャンペーンQ&A",
      "checkedAt": "2026-06-30",
      "scope": "Special menu schedule, set contents, clear-card bonus, recovery-item serial-code handling, WEB lottery receipt-code printing window, web-entry window, original blanket prize, store-goods sales limits, acrylic panel purchase limits, and campaign caveats.",
      "language": "ja",
      "reliability": "primary"
    }
  ],
  "evidence": [
    {
      "id": "ev-campaign-title",
      "sourceId": "cocos-umamusume-special-site",
      "factType": "campaign-title",
      "claimJa": "ココスへようこそ！ウマいものフェス！",
      "claimEn": "COCOS Umaimono Festival campaign",
      "sourceLocator": {
        "sectionLabel": "Campaign title / main visual",
        "note": "Golden replay evidence derived from the existing verified COCOS data fixture."
      },
      "confidence": "official",
      "reviewRequired": false
    },
    {
      "id": "ev-campaign-period",
      "sourceId": "cocos-umamusume-special-site",
      "factType": "campaign-period",
      "claimEn": "2026 Jan-Mar",
      "sourceLocator": {
        "sectionLabel": "Campaign schedule",
        "note": "Golden replay evidence derived from the existing verified COCOS data fixture."
      },
      "confidence": "official",
      "reviewRequired": false
    },
    {
      "id": "ev-campaign-lineup",
      "sourceId": "cocos-umamusume-special-site",
      "factType": "campaign-lineup",
      "claimEn": "COCOS campaign archive covering menu-order clear cards, special set bonuses, web-lottery prizes, official-X poster prizes, and limited store goods.",
      "sourceLocator": {
        "sectionLabel": "Goods and campaign overview",
        "note": "Golden replay evidence derived from the existing verified COCOS data fixture."
      },
      "confidence": "official",
      "reviewRequired": false
    },
    {
      "id": "ev-cocos-original-clear-cards-name",
      "sourceId": "cocos-umamusume-special-site",
      "factType": "item-name",
      "claimJa": "オリジナルクリアカード",
      "claimEn": "Original clear cards",
      "sourceLocator": {
        "sectionLabel": "Item lineup",
        "note": "Golden replay evidence derived from the existing verified COCOS item data."
      },
      "confidence": "official",
      "reviewRequired": false
    },
    {
      "id": "ev-cocos-original-clear-cards-acquisition",
      "sourceId": "cocos-umamusume-special-site",
      "factType": "item-acquisition-method",
      "claimJa": "対象メニュー1品ごとの注文特典としてランダム配布",
      "sourceLocator": {
        "sectionLabel": "How to obtain",
        "note": "Golden replay evidence derived from the existing verified COCOS item data."
      },
      "confidence": "official",
      "reviewRequired": false
    },
    {
      "id": "ev-cocos-original-clear-cards-availability",
      "sourceId": "cocos-umamusume-special-site",
      "factType": "item-availability",
      "claimJa": "2026年1月20日〜3月16日、または各弾の在庫がなくなり次第終了",
      "sourceLocator": {
        "sectionLabel": "Availability / schedule",
        "note": "Golden replay evidence derived from the existing verified COCOS item data."
      },
      "confidence": "official",
      "reviewRequired": false
    },
    {
      "id": "ev-cocos-special-set-menu-name",
      "sourceId": "cocos-umamusume-special-site",
      "factType": "item-name",
      "claimJa": "ウマいものフェス特別メニュー",
      "claimEn": "Umaimono Festival special menu",
      "sourceLocator": {
        "sectionLabel": "Item lineup",
        "note": "Golden replay evidence derived from the existing verified COCOS item data."
      },
      "confidence": "official",
      "reviewRequired": false
    },
    {
      "id": "ev-cocos-special-set-menu-acquisition",
      "sourceId": "cocos-umamusume-special-site",
      "factType": "item-acquisition-method",
      "claimJa": "ウマいものフェス特別メニューを注文",
      "sourceLocator": {
        "sectionLabel": "How to obtain",
        "note": "Golden replay evidence derived from the existing verified COCOS item data."
      },
      "confidence": "official",
      "reviewRequired": false
    },
    {
      "id": "ev-cocos-special-set-menu-availability",
      "sourceId": "cocos-umamusume-special-site",
      "factType": "item-availability",
      "claimJa": "2026年1月20日〜3月16日、または在庫がなくなり次第終了",
      "sourceLocator": {
        "sectionLabel": "Availability / schedule",
        "note": "Golden replay evidence derived from the existing verified COCOS item data."
      },
      "confidence": "official",
      "reviewRequired": false
    },
    {
      "id": "ev-cocos-acrylic-stand-panels-name",
      "sourceId": "cocos-umamusume-special-site",
      "factType": "item-name",
      "claimJa": "オリジナルアクリルスタンドパネル",
      "claimEn": "Original acrylic stand panels",
      "sourceLocator": {
        "sectionLabel": "Item lineup",
        "note": "Golden replay evidence derived from the existing verified COCOS item data."
      },
      "confidence": "official",
      "reviewRequired": false
    },
    {
      "id": "ev-cocos-acrylic-stand-panels-acquisition",
      "sourceId": "cocos-umamusume-special-site",
      "factType": "item-acquisition-method",
      "claimJa": "一部店舗限定の店頭販売で購入",
      "sourceLocator": {
        "sectionLabel": "How to obtain",
        "note": "Golden replay evidence derived from the existing verified COCOS item data."
      },
      "confidence": "official",
      "reviewRequired": false
    },
    {
      "id": "ev-cocos-acrylic-stand-panels-availability",
      "sourceId": "cocos-umamusume-special-site",
      "factType": "item-availability",
      "claimJa": "前半: 2026年1月20日〜3月16日 / 後半: 2026年2月17日〜3月16日、なくなり次第終了",
      "sourceLocator": {
        "sectionLabel": "Availability / schedule",
        "note": "Golden replay evidence derived from the existing verified COCOS item data."
      },
      "confidence": "official",
      "reviewRequired": false
    },
    {
      "id": "ev-cocos-original-blanket-name",
      "sourceId": "cocos-umamusume-special-site",
      "factType": "item-name",
      "claimJa": "オリジナルブランケット",
      "claimEn": "Original blanket",
      "sourceLocator": {
        "sectionLabel": "Item lineup",